<?xml version="1.0" encoding="UTF-8"?>

<!DOCTYPE pokedex SYSTEM "pokedex.dtd">
<?xml-model href="pokedex.xsd" type="application/xml" schematypens="http://www.w3.org/2001/XMLSchema"?>
<?xml-stylesheet href="pokemon.xslt" type="text/xsl"?>
<pokedex>
    <pokemon nombre="bulbasaur" num_pokedex="1" url_imagen="https://images.wikidexcdn.net/mwuploads/wikidex/thumb/4/43/latest/20190406170624/Bulbasaur.png/800px-Bulbasaur.png">
        <evoluciones>
            <evolucion>
                <orden>-1</orden>
                <num_pokedex>2</num_pokedex>
            </evolucion>
        </evoluciones>
        <tipologia>
            <tipos>
                <tipo>
                    <descripcion>planta</descripcion>
                </tipo>
            </tipos>
            <debilidades>
                <debilidad>
                    <tipo_debilidad>fuego</tipo_debilidad>
                    <efectividad>x2</efectividad>
                </debilidad>
            </debilidades>
            <fortalezas>
                <fortaleza>
                    <tipo_fortaleza>agua</tipo_fortaleza>
                    <efectividad_fortaleza>x2</efectividad_fortaleza>
                </fortaleza>
                <fortaleza>
                    <tipo_fortaleza>tierra</tipo_fortaleza>
                    <efectividad_fortaleza>x2</efectividad_fortaleza>
                </fortaleza>
            </fortalezas>
        </tipologia>
        <datos_generales>
            <altura>0.45</altura>
            <peso>20</peso>
            <sexo>M</sexo>
            <categoria>Semilla</categoria>
            <habilidad>Espesura</habilidad>
        </datos_generales>
        <stats_base>
            <ps>30</ps>
            <at>10</at>
            <def>12</def>
            <spat>15</spat>
            <spde>13</spde>
            <vel>5</vel>
        </stats_base>
        
    </pokemon>
    <pokemon nombre="pikachu" num_pokedex="1" url_imagen="https://encrypted-tbn0.gstatic.com/images?q=tbn:ANd9GcQw3iIiDJQW4HYJk2osK19O3RQ4Hs4MDSF8PQ&s">
        <evoluciones>
            <evolucion>
                <orden>-1</orden>
                <num_pokedex>2</num_pokedex>
            </evolucion>
        </evoluciones>
        <tipologia>
            <tipos>
                <tipo>
                    <descripcion>planta</descripcion>
                </tipo>
            </tipos>
            <debilidades>
                <debilidad>
                    <tipo_debilidad>fuego</tipo_debilidad>
                    <efectividad>x2</efectividad>
                </debilidad>
            </debilidades>
            <fortalezas>
                <fortaleza>
                    <tipo_fortaleza>agua</tipo_fortaleza>
                    <efectividad_fortaleza>x2</efectividad_fortaleza>
                </fortaleza>
                <fortaleza>
                    <tipo_fortaleza>tierra</tipo_fortaleza>
                    <efectividad_fortaleza>x2</efectividad_fortaleza>
                </fortaleza>
            </fortalezas>
        </tipologia>
        <datos_generales>
            <altura>0.45</altura>
            <peso>20</peso>
            <sexo>M</sexo>
            <categoria>Semilla</categoria>
            <habilidad>Espesura</habilidad>
        </datos_generales>
        <stats_base>
            <ps>30</ps>
            <at>10</at>
            <def>12</def>
            <spat>15</spat>
            <spde>13</spde>
            <vel>5</vel>
        </stats_base>
        
    </pokemon>
</pokedex>